{
  "base_report": {
    "content_digest": "fe5ff5a6d0de7f5fda69425d062d717b166c40f4f1610daba6b75b05b09f805f",
    "report_id": "atlrep-302f83dc9de1b8ef047905a6b5074477",
    "schema_version": "6.0.0"
  },
  "changed_dimensions": [
    {
      "after": {
        "status": "observed",
        "value": true
      },
      "before": {
        "status": "observed_absent",
        "value": false
      },
      "dimension": "su_binary_visibility",
      "evidence_paths": [
        "root_state.su_binary_observed"
      ],
      "interpretation": "Trust-state dimension changed between reports.",
      "severity": "medium"
    }
  ],
  "compare_report": {
    "content_digest": "723d5c10f281c89e72cd507101b9c1cc99d844069884a5e4819252cb533aaa8b",
    "report_id": "atlrep-77eadfc6e2272cb15337c0183d187aa6",
    "schema_version": "6.0.0"
  },
  "compatibility": {
    "canonical_comparison_schema_version": "6.0.0",
    "input_schema_versions": {
      "base": "6.0.0",
      "compare": "6.0.0"
    },
    "migration_mode": "temporary_in_memory",
    "migrations": {
      "base": [],
      "compare": []
    },
    "warnings": []
  },
  "confidence_changes": [],
  "content_digest": "da78d2337ab096d52d00031471bfe7fa6e0a275a97fe21b0e8788954f132d677",
  "diff_id": "atldiff-da78d2337ab096d52d00031471bfe7fa",
  "missing_signals": [],
  "new_signals": [],
  "provenance": {
    "base": {
      "applied_migrations": [],
      "common_report": {
        "content_digest": "fe5ff5a6d0de7f5fda69425d062d717b166c40f4f1610daba6b75b05b09f805f",
        "report_id": "atlrep-302f83dc9de1b8ef047905a6b5074477",
        "schema_version": "6.0.0"
      },
      "original_content_digest": "fe5ff5a6d0de7f5fda69425d062d717b166c40f4f1610daba6b75b05b09f805f",
      "original_document_digest": "4d91f1f57164e6695baa849fa1988b1a3f2bbfaa973bb1061bb2206d41d38b55",
      "original_report_id": "atlrep-302f83dc9de1b8ef047905a6b5074477",
      "original_schema_version": "6.0.0"
    },
    "common_report_schema_version": "6.0.0",
    "compare": {
      "applied_migrations": [],
      "common_report": {
        "content_digest": "723d5c10f281c89e72cd507101b9c1cc99d844069884a5e4819252cb533aaa8b",
        "report_id": "atlrep-77eadfc6e2272cb15337c0183d187aa6",
        "schema_version": "6.0.0"
      },
      "original_content_digest": "723d5c10f281c89e72cd507101b9c1cc99d844069884a5e4819252cb533aaa8b",
      "original_document_digest": "6276f339a4c2d671e62ffab161ff92aaf1579d4b273f25885f61c1cd69e6f859",
      "original_report_id": "atlrep-77eadfc6e2272cb15337c0183d187aa6",
      "original_schema_version": "6.0.0"
    }
  },
  "schema_version": "2.4.0",
  "summary": "1 dimensions changed, 28 dimensions unchanged.",
  "unchanged_dimensions": [
    "bootloader_lock_state",
    "verified_boot_state",
    "vbmeta_state",
    "verity_mode",
    "selinux_mode",
    "selinux_current_context",
    "selinux_denial_collection",
    "selected_process_visibility",
    "mount_integrity",
    "system_mount_resolution",
    "dynamic_partition_state",
    "apex_mount_set",
    "observer_uid_root",
    "root_shell_availability",
    "su_invocation_tested",
    "su_invocation_result",
    "root_management_artifact",
    "magisk_binary_visibility",
    "magisk_daemon_visibility",
    "magisk_process_visibility",
    "zygisk_visibility",
    "magisk_version_name",
    "magisk_version_code",
    "magisk_module_context",
    "magisk_command_status",
    "property_consistency",
    "emulator_state",
    "observer_privilege"
  ]
}
